Spiced Mango Lassi,Nonfat mango lassi with spices just like in the Indian restaurants.,4.75,10 mins
Grilled Chocolate Sandwich,"This is JUST like making a grilled cheese, but you are using chocolate! Created this while craving chocolate and carbs.",5 ,20 mins
Milk Chocolate Cheesecake,Top your smooth and creamy Milk Chocolate Cheesecake with generous spoonfuls of whipped cream and fresh strawberries.,4.5,3 hrs 45 mins
Spicy Jalapeno-Bacon Mac and Cheese,This mac and cheese has an intense sharp Cheddar cheese flavor with the kick of the jalapenos.,5 ,55 mins
Naan Ham and Cheese,Ham and cheese using naan bread.,4.5,10 mins
Vanilla Bean Cheesecake,"If you like restaurant vanilla bean cheesecake, then try this!  The cookies make this one much more special and far more yummy. Pure vanilla bean extract is a must.  I use Tahitian vanilla beans and extract.  This also makes more than enough batter for a 10 inch pan, so you can make cupcakes too.",4.8,5 hrs 45 mins
Chipotle Macaroni and Cheese,Creamy mac and cheese gets a spicy kick with the addition of chipotle peppers and pepper jack cheese.,4.61,50 mins
Grilled Chipotle Marinated Chicken,"This chicken is grilled after being marinated in a spicy marinade. The chipotle chiles give the marinade its smoky flavor. You can increase the heat to your liking with your favorite hot sauce. Habanero hot sauce works best, as very little is needed to increase the heat without changing the flavor of the marinade. I think mesquite charcoal works best as it enhances the flavor.",4.61,6 hrs 30 mins
